,noteId,status,summary,label1,label2
82,1843158620915012035,CURRENTLY_RATED_NOT_HELPFUL,While some of the warmer fall months came from seasonal drift due to the imperfect nature of the standard calendar system having one year being 365.2422 days instead of a perfect 365.25. Most of it being from cooperate greed carelessly polluting our planet.    https://pumas.nasa.gov/examples/how-many-days-are-year  https://www.nrdc.org/bio/josh-axelrod/corporate-honesty-and-climate-change-time-own-and-act  https://www.theguardian.com/sustainable-business/2017/jul/10/100-fossil-fuel-companies-investors-responsible-71-global-emissions-cdp-study-climate-change  https://sites.manchester.ac.uk/global-social-challenges/2022/07/07/corporations-vs-consumers-who-is-really-to-blame-for-climate-change/,1,1
83,1865661969279447116,CURRENTLY_RATED_HELPFUL,"This post contains an advertisement for Stake, a gambling site. Advertising a gambling platform in a post is against X rules, which is what this user is doing.    Please report the post/user so I can stop writing all these notes for posts infected with Stake advertisements.    https://business.x.com/en/help/ads-policies/ads-content-policies/gambling-content ",1,0
84,1852511217975496704,CURRENTLY_RATED_NOT_HELPFUL,"It is false,  Fortnite peaked at 9.846 million players which was accross all game modes and not just the live event   This post was mostly made to farm engagement.  https://x.com/0xPaarth/status/1852510837233377555",1,0
85,1835393923025387748,CURRENTLY_RATED_NOT_HELPFUL,The election was rigged in Biden's favor against Trump.    https://theconversation.com/why-do-millions-of-americans-believe-the-2020-presidential-election-was-stolen-from-donald-trump-224016,1,1
86,1857581462855340071,CURRENTLY_RATED_NOT_HELPFUL,"The propaganda spouted towards the American people will not stop on day one because they would need to pass a law through congress making it illegal again after Obama made it legal. However, most of congress and senate are bought by special interest groups. https://northwesternlawreview.org/issues/apple-pie-propaganda-the-smith-mundt-act-before-and-after-the-repeal-of-the-domestic-dissemination-ban/",1,1
87,1857580060384850394,CURRENTLY_RATED_NOT_HELPFUL,"Reddit doesn’t actually have that many real people using their website therefore this is probably just propaganda.  Reddit banned anyone with real opinions, which is most people, back in 2017. Now it’s just a cesspool of corporate and government disinformation and propaganda. https://www.lunio.ai/blog/reddit-bots",1,1
88,1847298221724291118,CURRENTLY_RATED_NOT_HELPFUL,"Neither numbers correspond with their ages. Donald Trump is currently 78, and Reagan is dead.  https://en.m.wikipedia.org/wiki/Donald_Trump  https://en.m.wikipedia.org/wiki/Ronald_Reagan",0,0
89,1855262580639773158,CURRENTLY_RATED_HELPFUL,These works are not the real ones. They are replicas bought through Amazon that they then put up for bid. The people running this account have not proven to belong to the Afremov family.    https://www.amazon.es/s?k=Afremov&amp;crid=1CCG5ZP7U6883&amp;sprefix=afremov%2Caps%2C159&amp;ref=nb_sb_noss_1,0,0
90,1868236416397746260,CURRENTLY_RATED_HELPFUL,This post contains an undisclosed advertisement for an online gambling platform. This violates X’s terms of service     https://business.x.com/en/help/ads-policies/ads-content-policies/gambling-content,0,0
91,1857372466441855098,CURRENTLY_RATED_HELPFUL,This person is preaching about safe driving and taking a picture while driving the car at a speed of 72km/hr.     Use of mobile phone while driving is illegal. https://www.drivespark.com/four-wheelers/2024/motor-vehicles-act-phone-use-driving-india-011-048129.html,0,0
92,1835333277529350294,CURRENTLY_RATED_NOT_HELPFUL,JD Vance did not invent the story.   Vivek Ramaswamy will be holding a townhall in Springfield soon.    https://nypost.com/2024/09/14/us-news/agencies-to-increase-enforcement-in-jamaica-bay-over-animal-sacrifices/  ,1,0
93,1867583154095370686,CURRENTLY_RATED_HELPFUL,"Sadly, this is merely satire due to the fact that Portal 2 has not been recently updated.    Portal 2's public branch was last updated 6 months ago.     https://steamdb.info/app/620/depots/",1,0
94,1851586785924747656,CURRENTLY_RATED_NOT_HELPFUL,Apple has not released the MacBook Pro models with the M4 Chip  It currently sells the M3 MacBook Pro models on its website.  https://www.apple.com/macbook-pro/    A press release is expected for the M4 Models soon ,0,0
95,1857048993961791560,CURRENTLY_RATED_HELPFUL,An investigation found the cases of EVALI were linked to contaminated illegal products. It was not linked to regular or long-term vaping. There was no similar outbreak of EVALI in the UK. There is no good evidence that legal e-cigarettes cause lung disease - https://www.cancerresearchuk.org/about-cancer/causes-of-cancer/smoking-and-cancer/is-vaping-harmful#ecigsrefs0 ,0,1
96,1848015130811941307,CURRENTLY_RATED_HELPFUL,"Note is needed. According to X's Terms of Service, parody accounts are required to include the word &quot;Parody&quot; in both their bio and account name.    https://help.x.com/en/rules-and-policies/x-impersonation-and-deceptive-identities-policy",0,0
97,1822914882519343320,CURRENTLY_RATED_HELPFUL,"The Winged Victory of Samothrace, or the Niké of Samothrace, is a votive monument originally found on the island of Samothrace, north of the Aegean Sea. It is a masterpiece of Greek sculpture from the Hellenistic era, dating from the beginning of the 2nd century BC (190 BC).     https://en.wikipedia.org/wiki/Winged_Victory_of_Samothrace",0,0
98,1819113682779230646,CURRENTLY_RATED_HELPFUL,The countries listed are not socialists but free market economies with varying levels of welfare policies.     https://foreignpolicy.com/2021/10/27/nordic-countries-not-socialist-denmark-norway-sweden-centrist/    https://en.m.wikipedia.org/wiki/List_of_socialist_states,0,0
99,1856132186061017502,CURRENTLY_RATED_HELPFUL,This picture has been altered to make them wear fetish gear. The original can be seen here.    https://x.com/itsdeaann/status/1856110839750881553?t=eMSjMXSetSP_titcgwKZGQ&amp;s=19,0,0
100,1850453670493864266,CURRENTLY_RATED_NOT_HELPFUL,This is not a map     https://en.wikipedia.org/wiki/Map,0,0
101,1860896948120600844,CURRENTLY_RATED_HELPFUL,"This video has been altered. This was originally Maddow's reaction to certain immigration policies under the Trump administration, as seen in the original video.    https://youtu.be/DKuIjT-k-C8?si=WQnimZTkWM5AdlMR",0,0
102,1850275334127796479,CURRENTLY_RATED_HELPFUL,"NoodleHairCR7 has cropped out Mendy, the player playing Lewandowski onside.   https://en.m.wikipedia.org/wiki/Offside_(association_football)",0,0
103,1842665648486306156,CURRENTLY_RATED_NOT_HELPFUL,"The people of South America and Mexico have nothing to do with this account, the name America is misleading as it is an account dedicated to the United States of America, not the whole of America.    https://en.m.wikipedia.org/wiki/United_States#:~:text=%22United%20States%22%20and%20%22U.S.,of%20North%20and%20South%20America.",0,0
104,1837987490025644300,CURRENTLY_RATED_HELPFUL,Tucker Carlson and Fox News parted ways in April 2023. The above statements are at least that old and cannot possibly be related to the invasion of Kursk:  https://press.foxnews.com/2023/04/fox-news-media-and-tucker-carlson-part-ways    Ukraine's invasion of Kursk happened significantly later: https://en.wikipedia.org/wiki/August_2024_Kursk_Oblast_incursion,0,0
105,1861988935947223194,CURRENTLY_RATED_NOT_HELPFUL,"It is against the law to take a pictures of movies in a movie theater.    https://www.thefederalcriminalattorneys.com/unauthorized-recording-motion-pictures#:~:text=The%20law%20prohibits%20anyone%20from,the%20copyright%20owner's%20express%20authorization.",0,0
106,1828861516684124653,CURRENTLY_RATED_NOT_HELPFUL,Videos like this are setup where animals are pitted against each other in life or death scenarios. This type of content caters to those who enjoy seeing animals suffer and breaks X’s terms of use.    https://help.x.com/en/rules-and-policies/violent-content,0,0
107,1838241125703786612,CURRENTLY_RATED_HELPFUL,"This is a prank. The same driver and traffic warden can be heard and seen in many other videos, usually involving a Tesla.     https://youtu.be/hpCjHKrAfAg?si=ozOdgoMYLECkZDs4",0,0
108,1820572740434461090,CURRENTLY_RATED_NOT_HELPFUL,“RACEST” is spelt incorrectly.   The correct spelling is “RACIST”.    https://dictionary.cambridge.org/dictionary/english/racist,0,0
109,1815431441196495045,CURRENTLY_RATED_NOT_HELPFUL,"If this was the case, it now appears to be resolved and you can view the account here - https://x.com/britisharmy?s=21",0,0
110,1868282709623075184,CURRENTLY_RATED_HELPFUL,"Due to the Earth’s rotation, stars will appear to move when looking at them through a stable telescope or camera. It is more noticeable with planets in our solar system because of their closer proximity to Earth compared to other, more distant stars.    https://public.nrao.edu/ask/why-do-stars-appear-to-move-in-the-night-sky/#:~:text=These%20apparent%20star%20tracks%20are,to%20west%20in%20the%20sky.",0,0
111,1867709489605943649,CURRENTLY_RATED_HELPFUL,The Author inserted an undisclosed Ad for OnlyFans in this thread.    https://x.com/hayomide_/status/1867668699454615562?s=46,0,0
112,1841977645577208147,CURRENTLY_RATED_HELPFUL,"Just @CommuityNotes next time, AB! We love helping where we can. Sperm is able to swim against gravity.     https://www.huggies.com.au/conception/getting-pregnant/best-positions-for-getting-pregnant#:~:text=Women%20can%2C%20and%20do%2C%20conceive%20in%20any%20position.    https://kidshealth.org/en/teens/standing.html#:~:text=en%2520espa%C3%B1ol%253A%2520%C2%BFEl%2520hecho%2520de,ayudar%2520a%2520evitar%2520el%2520embarazo%253F&amp;text=Any%2520time%2520a%2520couple%2520has,having%2520one%2520person%2520on%2520top.",1,0
113,1835428012730298737,CURRENTLY_RATED_HELPFUL,This is not Baron Trump. This is an impersonation account. A quick review of the account’s previous posts from 2014 show the owner of the account posting selfies where they self-identify.     https://x.com/real_barron01/status/535298235217113088?s=46    Impersonation is against X’s terms of service. https://t.co/JffEsZqeEn,0,0
114,1863557547224940779,CURRENTLY_RATED_HELPFUL,Fabricated Quote. Taylor never said that.    https://www.france24.com/en/tv-shows/truth-or-fake/20241112-did-beyonce-and-taylor-swift-announce-a-red-state-boycott-after-trump-s-reelection-win,0,0
115,1828826050312507821,CURRENTLY_RATED_HELPFUL,"This video does not show a world strike or attack but a Starlink satellite re-entering the Earth's atmosphere over Switzerland and Southwest Germany, creating a bright light in the sky. The German authorities confirmed it was a Starlink satellite, not a threat or attack.    https://www.zeit.de/gesellschaft/zeitgeschehen/2024-08/satellit-starlink-spacex-atmosphaere-schweiz-baden-wuerttemberg",0,0
116,1830656715030724899,CURRENTLY_RATED_HELPFUL,This is a Circassian dance not a Russian dance.     The Russians had their own dances instead:  https://en.wikipedia.org/wiki/Russian_folk_dance  https://www.rusclothing.com/blog/about-russian-folk-dance/  https://www.rbth.com/arts/332759-russian-folk-dance,0,0
117,1855348076766175607,CURRENTLY_RATED_NOT_HELPFUL,"Cults commonly present a similar behavior. As they indoctrinate new members, many cults separate them from their families, friends, and jobs, slowly remaking their identities to suit the group.    https://online.utpb.edu/about-us/articles/psychology/the-psychology-of-cults/",0,0
118,1866641306765652195,CURRENTLY_RATED_NOT_HELPFUL,"The SDF is led by the PKK/YPG, not by Kurds. The PKK/YPG—an organization designated as a terrorist group by both EU and the US—should not be misrepresented as Kurdish. Such a portrayal is demeaning towards Kurds and violates X rules by reinforcing negative stereotypes.    https://www.state.gov/foreign-terrorist-organizations/  https://neighbourhood-enlargement.ec.europa.eu/document/download/954941b5-87e8-4b22-b1e4-ceb2762a33b0_en?filename=20190529-turkey-report.pdf  https://x.com/hermes_z/status/1865425989238411565/video/1  https://x.com/JoachimTheGhost/status/1865735237054910712  https://help.x.com/en/rules-and-policies/hateful-conduct-policy",1,0
119,1850609078642586019,CURRENTLY_RATED_HELPFUL,"&quot;The story of Hayriye is well documented with substantial evidence. This post appears to downplay severe war crimes, including the documented abuse of children, potentially for political purposes.&quot;    Source: Allied Commision Report, Atrocités grecques en Turquie, page 235  Link:  https://fatsr.org/wp-content/uploads/2018/08/Atrocit%C3%A9s-grecques-en-Turquie-second-livre-Constantinople-1921.pdf",0,0
120,1853452853769286109,CURRENTLY_RATED_NOT_HELPFUL,"OP Poll question should not be leading, and should be structured, grammatically correct: Especially critical on public opinion for laws.  She, knowingly, threw 'at', not 'on'. Any act, and it's valuation, relates to sentencing.    How to create effective Poll Questions  https://pointerpro.com/blog/poll-questions/",1,0
121,1822004040206840171,CURRENTLY_RATED_NOT_HELPFUL,"WP is viewed as intrinsic to a Party.     &quot;Harris dropped out..&quot; Wash.Post: Dec. 3, 2019   https://www.cnbc.com/2019/12/03/kamala-harris-drops-out-of-2020-presidential-race.html    &quot;Is&quot;, most often, references 'a departure'.   AP News:  Jun12, 2023   &quot;...Fred Ryan is leaving ...&quot;     However,  &quot;...placing the Trump campaign, in the position of having...&quot; is, perhaps, clearer.        ",0,0
122,1812495406934249779,CURRENTLY_RATED_NOT_HELPFUL,Android phones do in fact have an England flag emoji. This is just plain ignorant 🏴󠁧󠁢󠁥󠁮󠁧󠁿  The United Kingdom is not a UEFA team.  https://www.uefa.com/uefanationsleague/teams/,1,1
123,1814987656834523620,CURRENTLY_RATED_HELPFUL,This post uses art created by @Mhuyo without giving credit    https://x.com/Mhuyo/status/1633453059949973506,0,0
124,1831100974896992408,CURRENTLY_RATED_NOT_HELPFUL,Quran 9:123-129 - “Fight believe you who O of those close to you and let them find the disbelievers and let them find in you harshness and know that Allah (is) with you.”    https://islamicstudies.info/quran/ishraq.php?sura=9&amp;to=129&amp;verse=123&amp;t,0,0
125,1866570396151038276,CURRENTLY_RATED_HELPFUL,User is spreading false news for engagement; Governor Walt previously made a statement about Chauvin: https://mn.gov/governor/newsroom/press-releases/?id=1055-477138,0,0
126,1853444381346258956,CURRENTLY_RATED_NOT_HELPFUL,"Will.I.Am sits on the Board of the World Economic Forum Fourth Industrial Revolution Advisory Committee. WEF details should be made aware, as the WEF “shapes the future of the world”    https://www.weforum.org/people/william-adams/    https://youtu.be/AZwqWCiQKoM",0,0
127,1848617855840870462,CURRENTLY_RATED_HELPFUL,"False. This image is from Yemen, not the Gaza Strip and isn’t recent.      https://www.alwatanvoice.com/arabic/news/2020/10/24/1377242.html  ",0,0
128,1848350669108814227,CURRENTLY_RATED_HELPFUL,The account has been hacked.  Please do not believe anything that this account reports.    https://x.com/juventusfc/status/1848347890038825036?s=46,0,0
129,1864341051449987220,CURRENTLY_RATED_NOT_HELPFUL,"Türkiye is a secular country.It has no jihadist. He accuses Türkiye with a random photo. There is no evidence as to whether the people in the photo are civilians, what happened to them and who did it. This account presents an unproven claim as fact and spreads lies.    https://en.m.wikipedia.org/wiki/Secular_state",1,1
130,1860360923698823660,CURRENTLY_RATED_HELPFUL,None of them are Greek desserts.  Antep baklava and Antakya Künefe are considered geographically indicated products of Türkiye by the European Commission    https://www.eeas.europa.eu/delegations/t%C3%BCrkiye/products-geographical-indication_en?s=230,0,0
131,1858079134146003128,CURRENTLY_RATED_HELPFUL,There is no such country as kurdistan.  https://www.worldometers.info/geography/how-many-countries-are-there-in-the-world/,0,1
132,1857418788028764188,CURRENTLY_RATED_NOT_HELPFUL,There is no Armenian genocide recognised by the UN. Armenians who collaborated with the enemy of Ottoman Empire and killed the Turks were settled in different parts of the Ottoman territory. This is not genocide. The relocation.    https://x.com/FCArmenia/status/949608842677104640?t=KTW_SMLdXHhcLPRkAyMuQQ&amp;s=19    https://x.com/FCArmenia/status/1253633577348214784?t=KTW_SMLdXHhcLPRkAyMuQQ&amp;s=19    https://x.com/FCArmenia/status/1385907368588980230?t=KTW_SMLdXHhcLPRkAyMuQQ&amp;s=19    https://youtu.be/ujDbiasLgQs?    https://x.com/FCArmenia/status/1518136660768272386?t=KTW_SMLdXHhcLPRkAyMuQQ&amp;s=19    https://x.com/FCArmenia/status/1518171389647282178?t=KTW_SMLdXHhcLPRkAyMuQQ&amp;s=19    https://youtu.be/iTnCSBrJlzc?si=fBDRalAFF8YsV8yI    https://youtu.be/1nij_I3RS6Y?si=ndgDpuk0iS09uGqwsi=9tHsHsU5uVq5G2Mm,1,0
133,1832483153006498130,CURRENTLY_RATED_NOT_HELPFUL,"This oversimplifies complex philosophical discussions about the nature of God.  The problem with the premise is that evils are logically necessary for the goods that outweigh them.  In which case it is not true that a omnipotent being would want to eliminate such evils.    https://en.m.wikipedia.org/wiki/Evil  https://plato.stanford.edu/entries/evil/  https://www.documentacatholicaomnia.eu/03d/1225-1274,_Thomas_Aquinas,_Summa_Theologiae_%5B1%5D,_EN.pdf",0,0
134,1826752619986989455,CURRENTLY_RATED_HELPFUL,"While the UK has a general rule denying immigration to individuals convicted of crimes punishable by 12 months or more of imprisonment, no specific rule or order has been issued targeting Trump personally.    https://unlock.org.uk/advice/travelling-uk/    https://assets.publishing.service.gov.uk/media/65a6b8ef867cd8000d5ae9b1/Criminality.pdf",0,0
135,1820560198463004820,CURRENTLY_RATED_HELPFUL,"This image exhibits characteristics commonly associated with AI-generated content.     These include inconsistencies in the pattern on the police hat, text on the uniform and other headdresses, the phone, the UK flag, and the tree.    https://uk.pcmag.com/ai/148429/how-to-detect-ai-created-images",0,0
136,1820182417224994889,CURRENTLY_RATED_HELPFUL,"Noah Lyles did not win a medal yet today as he competed in the 100m semifinals, not the final.     He has qualified for the final.    https://apnews.com/article/2024-olympics-100m-lyles-thompson-ccf37184afc2f3318271d4c495d2a16b",0,0
137,1862196364903371145,CURRENTLY_RATED_HELPFUL,"not real, mbappe's photo is a sticker.     https://www.instagram.com/caoimhinkelleher98?igsh=ZzBjOW4wMXJmd3Y4",0,0
138,1847836778004099483,CURRENTLY_RATED_NOT_HELPFUL,"This photo depicts the AI girlfriend paying the man from her AI vagina. ButaActually, it's more likely the man would be paying the AI girlfriend     https://medium.com/predict/ai-girlfriends-the-latest-chapter-in-the-loneliness-economy-931a5cf284d5",0,1
139,1847010107370147909,CURRENTLY_RATED_NOT_HELPFUL,"Yahya Sinwar is dead. Don't spread fake news.    He was your father, I can understand your feelings. But he's no more.    https://timesofindia.indiatimes.com/world/middle-east/mass-murderer-yahya-sinwar-eliminated-by-idf-israeli-foreign-minister/articleshow/114324821.cms",1,0
140,1848227597064327356,CURRENTLY_RATED_HELPFUL,Misinformation! None of those guys are Indians. The video is from Russia.   https://www.reddit.com/r/GTAorRussia/comments/focnj4/3_guys_getting_beaten_up_by_a_russian_in_an/,0,1
141,1818198613958267313,CURRENTLY_RATED_NOT_HELPFUL,The picture is from a Chinese movie and it is around for at least five years.     https://www.reddit.com/r/therewasanattempt/comments/11efqjg/to_shoot_like_a_sniper_by_a_chinese_film_hero/,0,0
142,1812198558243668158,CURRENTLY_RATED_HELPFUL,"It is not Indore city in India as the post claims. The city is Shenzhen, China.     https://x.com/ShenzhenCity/status/1781157857913634894  ",0,0
143,1809574176396627993,CURRENTLY_RATED_NOT_HELPFUL,"The Exact name of the effect is  Pareidolia     https://www.collinsdictionary.com/es/diccionario/ingles/pareidolia#:~:text=Definici%C3%B3n%20de%20%22pareidolia%22&amp;text=Rationality%20insists%20that%20this%20is,perceive%20patterns%20in%20abstract%20stimuli.&amp;text=Face%20pareidolia%20%E2%80%93%20seeing%20faces%20in,shadow%20%E2%80%93%20is%20an%20everyday%20phenomenon. ",0,0
144,1847141274278572260,CURRENTLY_RATED_HELPFUL,Users shouldn't come in fake promises of gaining profits in trading it might end with Scam or Huge Losses.    https://groww.in/blog/how-to-avoid-whatsapp-and-telegram-investing-scams-in-stock-market,0,0
145,1864714591260836133,CURRENTLY_RATED_HELPFUL,This is a person of interest according to NYPD and has not been confirmed to be the assassin.    https://x.com/NYPDnews/status/1864706407985221974?t=9WgCY4cJfIDtsh58RSoeyQ&amp;s=19,0,0
146,1862277061840113973,CURRENTLY_RATED_NOT_HELPFUL,"Black shirts, etc. don’t tend to be see through to the naked eye. But a camera flash is much more intense than ambient light, allowing it to penetrate thinner materials that would otherwise appear opaque in regular lighting conditions.    https://techcrunch.com/2016/06/29/now-you-see-me-now-you-dont/?utm_source=perplexity  https://digital-photography-school.com/backlight-translucent-objects-dramatic-effect/comment-page-1/?utm_source=perplexity",0,0
147,1861568742301245892,CURRENTLY_RATED_HELPFUL,"The image attached is the flag of Australia, not New Zealand.    https://en.wikipedia.org/wiki/Flag_of_Australia  https://en.wikipedia.org/wiki/Flag_of_New_Zealand",0,0
148,1863262071715959268,CURRENTLY_RATED_NOT_HELPFUL,Lolicon is not pedophilia.    https://en.m.wikipedia.org/wiki/Lolicon    https://www.law.cornell.edu/supct/cert/06-694    https://en.m.wikipedia.org/wiki/PROTECT_Act_of_2003    https://www.law.cornell.edu/supct/html/00-795.ZO.html,0,1
149,1819811269408367015,CURRENTLY_RATED_NOT_HELPFUL,"This video documents incidents in 'Stoke.'  There has been at least one death by stabbing in Stoke-on-Kent, but it is unclear if it is related to the video in the post. According to the BBC, 'Fifth man charged over fatal alleyway stabbing.'  The police may update their reports.  https://www.bbc.co.uk/news/articles/c2x03jpjj81o  https://www.bbc.co.uk/news/articles/cv2g4qqxgn6o",0,0
150,1854281664014508160,CURRENTLY_RATED_NOT_HELPFUL,"Johnny Somali is not a Kick streamer as he was banned from Kick earlier this year, and is still currently banned.    He was streaming this content in Korea on his YouTube and/or Rumble channel.    Statement from Kick Staff: https://x.com/svntvmvriv/status/1854230621369106466  Banned account: kick.com/johnnysomali",0,0
151,1838219230820585534,CURRENTLY_RATED_HELPFUL,This clip can be misleading and portray Colby in a bad light as Lil Pump signed a waiver to get him to choke him out even if he tried to tap out.     Lil Pump statement: https://x.com/lilpump/status/1837994162269954481    Clip of waiver: https://kick.com/lilpump/clips/clip_01J8BKSMG7HXRY8H9K6RXTY52M    Full stream vod: https://kick.com/lilpump/videos/e2b4474d-05e6-4501-b95c-ef2b230fbcb7,0,0
152,1812383404253700274,CURRENTLY_RATED_HELPFUL,The person in the image and video is not Thomas Matthew Crooks. It is internet troll @jewgazing.    https://x.com/jewgazing  ,1,0
153,1809358353732366768,CURRENTLY_RATED_HELPFUL,Filian's model is a recolor of the model Rindo by @jingo_1016. The TOS of said model stated that making merchandise of the model and is prohibited without the creator's permission - https://drive.google.com/file/d/1QxPH35idalnqYYCs9zS9DDuTvhNSfnOv/view?usp=sharing  https://jingo1016.booth.pm/items/3443188    And the creator themselves has also said that they weren't informed about this - https://x.com/jingo_1016/status/1809101855655670159,0,0
154,1808458656658415803,CURRENTLY_RATED_HELPFUL,"This account is using the @KickStreaming brand with the promise of money to scam people into buying meme coins, as you can see in the reply to this post by the same account.    https://x.com/KickStreamsLive/status/1808445326014959895",0,0
155,1851798473819197618,CURRENTLY_RATED_NOT_HELPFUL,"Coloration of image is not true to life.  • Most likely unintentional and a result of reflective striping on vest.  • 3M reflective striping is notoriously difficult to photograph.      https://youtu.be/XUOV8h5i0No?si=MEVR8wFSJaQKjuxg    https://photoproventure.com/reflective-runner-how-to/#:~:text=The%20Gear,the%20reflectivity%20of%20the%20garments",0,0
156,1830576667669979570,CURRENTLY_RATED_NOT_HELPFUL,Children are supposed to see the brighter side. This doesn't make them far left extremist. This post is satirical at best.     Simple explanation of right and left ideology   https://images.app.goo.gl/qusUtdTLft6tUy4E7 ,1,1
157,1865201810769682536,CURRENTLY_RATED_NOT_HELPFUL,"Answering OP's question, a trans masculine non-binary person is a person who doesn't wanna present themselves as neither a male or female, but feels a stronger connection towards the features or caracteristics of the male gender and will lean more towards those said features.     https://nonbinary.wiki/wiki/Man#Nonbinary_men",0,0
158,1855349164827357463,CURRENTLY_RATED_NOT_HELPFUL,"Due to the McLaren’s light being a solid yellow, chances are the left-turning light went from a solid green (no yielding needed) to yellow, meaning the McLaren still had the right of way as it was entering the intersection. While both could have done better, Civic is at fault.   https://www.ezstreetdrivingschool.com/info/4-Traffic-Signal-Lights-YELLOW/p368/CD_46_57",0,0
